{
  "strategy": {
    "min_safe_time_s": 1.5, 
    "max_adjust_time": 5000,   
    "enable_replan": false,
    "enable_early_finish": false,
    "enable_timeout_exit": false,
    "enable_slow_arrival": false
  },
  "search": {
    "use_local_map": false,
    "enable_attempt_path": true,
    "safe_buffer":0.1,
    "max_time_ms": 2000
  },
  "bound_params": {
    "front_expansion": 0.05,
    "rear_expansion": 0.05,
    "side_expansion": 0.05
  },
  "dyn_params": {
    "target_speed": 0.3,
    "target_yaw_rate": 0.5
  }
}
